{
  "schemaVersion": 1,
  "id": "tm-tilt-v1",
  "orientation": "any",
  "background": "#08080c",
  "controls": [
    {
      "type": "panel",
      "id": "status",
      "x": "50%",
      "y": "12%",
      "w": "90%",
      "h": "18%",
      "z": 10
    },
    {
      "type": "gyro",
      "id": "tilt",
      "x": "50%",
      "y": "40%"
    },
    {
      "type": "stick",
      "id": "move",
      "x": "50%",
      "y": "74%",
      "size": "44%",
      "axis": "left",
      "mode": "floating",
      "deadzone": 0.08
    }
  ],
  "sensors": {
    "gyro": "tilt",
    "sensitivity": 1.2,
    "smoothing": 0.12
  }
}
